[
  {
    "symbol": "BTCUSDT",
    "source": "binance_klines",
    "interval": "1d",
    "open_time": "2026-03-06T00:00:00.000Z",
    "close_time": "2026-03-06T23:59:59.999Z",
    "open": 66000.0,
    "high": 67600.0,
    "low": 65500.0,
    "close": 67000.0,
    "volume": 20000.0,
    "quote_volume": 1300000000.0,
    "trade_count": 4200000,
    "dataset_version": "market-v0-binance-1d"
  },
  {
    "symbol": "BTCUSDT",
    "source": "binance_klines",
    "interval": "1d",
    "open_time": "2026-03-07T00:00:00.000Z",
    "close_time": "2026-03-07T23:59:59.999Z",
    "open": 67000.0,
    "high": 68200.0,
    "low": 66400.0,
    "close": 67500.0,
    "volume": 20200.0,
    "quote_volume": 1310000000.0,
    "trade_count": 4210000,
    "dataset_version": "market-v0-binance-1d"
  },
  {
    "symbol": "BTCUSDT",
    "source": "binance_klines",
    "interval": "1d",
    "open_time": "2026-03-08T00:00:00.000Z",
    "close_time": "2026-03-08T23:59:59.999Z",
    "open": 67500.0,
    "high": 67900.0,
    "low": 66100.0,
    "close": 66800.0,
    "volume": 19800.0,
    "quote_volume": 1290000000.0,
    "trade_count": 4190000,
    "dataset_version": "market-v0-binance-1d"
  },
  {
    "symbol": "BTCUSDT",
    "source": "binance_klines",
    "interval": "1d",
    "open_time": "2026-03-09T00:00:00.000Z",
    "close_time": "2026-03-09T23:59:59.999Z",
    "open": 66800.0,
    "high": 69100.0,
    "low": 66500.0,
    "close": 68432.16,
    "volume": 21500.0,
    "quote_volume": 1380000000.0,
    "trade_count": 4300000,
    "dataset_version": "market-v0-binance-1d"
  },
  {
    "symbol": "BTCUSDT",
    "source": "binance_klines",
    "interval": "1d",
    "open_time": "2026-03-10T00:00:00.000Z",
    "close_time": "2026-03-10T23:59:59.999Z",
    "open": 68432.16,
    "high": 70050.0,
    "low": 68100.0,
    "close": 69010.0,
    "volume": 22000.0,
    "quote_volume": 1420000000.0,
    "trade_count": 4380000,
    "dataset_version": "market-v0-binance-1d"
  },
  {
    "symbol": "BTCUSDT",
    "source": "binance_klines",
    "interval": "1d",
    "open_time": "2026-03-11T00:00:00.000Z",
    "close_time": "2026-03-11T23:59:59.999Z",
    "open": 69010.0,
    "high": 69800.0,
    "low": 68800.0,
    "close": 69250.0,
    "volume": 21800.0,
    "quote_volume": 1410000000.0,
    "trade_count": 4370000,
    "dataset_version": "market-v0-binance-1d"
  },
  {
    "symbol": "BTCUSDT",
    "source": "binance_klines",
    "interval": "1d",
    "open_time": "2026-03-12T00:00:00.000Z",
    "close_time": "2026-03-12T23:59:59.999Z",
    "open": 69250.0,
    "high": 70700.0,
    "low": 69000.0,
    "close": 70541.34,
    "volume": 22600.0,
    "quote_volume": 1440000000.0,
    "trade_count": 4450000,
    "dataset_version": "market-v0-binance-1d"
  },
  {
    "symbol": "BTCUSDT",
    "source": "binance_klines",
    "interval": "1d",
    "open_time": "2026-03-13T00:00:00.000Z",
    "close_time": "2026-03-13T23:59:59.999Z",
    "open": 70541.34,
    "high": 73913.74,
    "low": 70386.01,
    "close": 71212.0,
    "volume": 33980.22595,
    "quote_volume": 2448911835.871854,
    "trade_count": 5100876,
    "dataset_version": "market-v0-binance-1d"
  }
]
